{
  "schema_version": "sesslint.snapshot/v1",
  "observed_at": "2026-10-20T12:00:00Z",
  "completeness": "complete",
  "origin": "target_system",
  "demo": false,
  "records": [
    {
      "order_ref": "0001",
      "status": "Shipped ",
      "sku": "SKU-A",
      "warehouse": "EU-1",
      "shipped_at": "2026-10-20T08:40:00Z",
      "weight_kg": 2.5
    },
    {
      "order_ref": "0004",
      "status": "shipped",
      "sku": "SKU-D",
      "warehouse": "US-2",
      "shipped_at": "2026-10-20T08:50:00Z",
      "weight_kg": 1
    },
    {
      "order_ref": "0005",
      "status": "shipped",
      "sku": "SKU-E",
      "warehouse": "US-2",
      "shipped_at": "2026-10-20T10:00:00Z",
      "weight_kg": 4
    },
    {
      "order_ref": "0007",
      "status": "delivered",
      "sku": "SKU-G",
      "warehouse": "US-1",
      "shipped_at": "2026-10-20T09:20:00Z",
      "weight_kg": 3
    },
    {
      "order_ref": "0008",
      "status": "shipped",
      "sku": "SKU-H",
      "warehouse": "US-1",
      "shipped_at": "2026-10-20T09:15:00Z",
      "weight_kg": 3
    },
    {
      "order_ref": "0008",
      "status": "shipped",
      "sku": "SKU-H",
      "warehouse": "US-1",
      "shipped_at": "2026-10-20T09:16:00Z",
      "weight_kg": 3
    },
    {
      "order_ref": "0099",
      "status": "shipped",
      "sku": "SKU-Z",
      "warehouse": "US-1",
      "shipped_at": "2026-10-20T09:30:00Z",
      "weight_kg": 1
    }
  ]
}
